{
  "schema_version": "moraine-benchmark-v1",
  "benchmark_id": "replay-mcp-latency",
  "scenario_id": "full-warm-central",
  "source": {
    "git_commit": "0123456789abcdef0123456789abcdef01234567",
    "dirty": false
  },
  "build": {
    "profile": "release",
    "target": "aarch64-apple-darwin"
  },
  "runner": {
    "os": "darwin",
    "cpu_class": "apple-silicon"
  },
  "scenario": {
    "profile": "full",
    "workload_id": "seeded-replay-v1",
    "measured_boundary": "end-to-end-mcp",
    "dimensions": {
      "dataset_backed": true,
      "cache_sensitive": true,
      "concurrent": true,
      "request_producing": true
    },
    "fingerprints": {
      "dataset": {
        "fingerprint": "sha256:aaaaaaaaaaaaaaaaaaaaaaaaaaaaaaaaaaaaaaaaaaaaaaaaaaaaaaaaaaaaaaaa",
        "cardinality": 3
      },
      "cache_state": "warm",
      "concurrency": 2,
      "request_source": "central-mcp"
    }
  },
  "samples": {
    "planned": 3,
    "attempted": 3,
    "successful": 3,
    "errors": 0,
    "measurements": {
      "latency_ms": [10.0, 11.0, 9.0]
    }
  },
  "semantic": {
    "status": "pass"
  },
  "timing": {
    "status": "pass",
    "non_blocking": true,
    "comparison_policy": {
      "statistic": "median",
      "minimum_independent_run_pairs": 1,
      "threshold": {
        "maximum_relative_regression": 0.2
      },
      "error_rate": {
        "maximum": 0.0
      },
      "variability": {
        "statistic": "coefficient_of_variation",
        "maximum": 0.5
      }
    }
  },
  "metrics": {
    "quality": {
      "oracle_status": "pass",
      "passed_checks": 3,
      "failed_checks": 0,
      "success_rate": 1.0
    },
    "resources": {
      "peak_rss_bytes": 1048576
    },
    "model_tokens": {
      "input_tokens": 10,
      "output_tokens": 5,
      "total_tokens": 15
    }
  },
  "diagnostics": [
    {
      "code": "summary-retained",
      "artifact_id": "summary"
    }
  ],
  "artifacts": [
    {
      "id": "summary",
      "kind": "summary-json",
      "path": "target/bench/summary.json",
      "sha256": "bbbbbbbbbbbbbbbbbbbbbbbbbbbbbbbbbbbbbbbbbbbbbbbbbbbbbbbbbbbbbbbb"
    }
  ]
}
